{"$schema":"https://ofxograf.dev/schema/broadcast-scene-0.3.schema.json","format":"broadcast-scene","version":"0.3.0","id":"scene:test-neutral","generator":{"id":"cc.openframeworks.ofxograf.tests","version":"1.0.0"},"provenance":[],"coordinateSystem":{"origin":"top-left","xAxis":"right","yAxis":"down","units":"pixels"},"rootCompositionId":"composition:main","compositions":[{"id":"composition:main","name":"Main","width":1920,"height":1080,"duration":1,"frameRate":{"numerator":50,"denominator":1},"layers":[],"extensions":{}}],"assets":[],"controls":[],"actions":[],"requiredExtensions":[{"id":"dev.ofxograf.tests.missing","version":"1.0.0","capabilities":["render"]}],"extensions":{}}